Name,Job_Title,Skills,Experience
Person 344,HR Manager,"Performance Management, HR Software, Labor Laws",1 years
Person 345,Data Scientist,"NumPy, Deep Learning, Statistics",10 years
Person 346,Marketing Manager,"Email Marketing, PPC, Market Research",10 years
Person 347,Financial Analyst,"Budgeting, QuickBooks, Financial Modeling",10 years
Person 348,Customer Support,"Customer Service, Time Management, CRM Software",4 years
Person 349,Digital Marketer,"PPC, Email Marketing, Content Creation",3 years
Person 350,HR Manager,"Training, Labor Laws, Recruitment",7 years
Person 351,Mechanic,"Diagnostics, Vehicle Maintenance, Blueprint Reading",5 years
Person 352,Digital Marketer,"Email Marketing, Google Ads, Brand Strategy",9 years
Person 353,Legal Advisor,"Legal Writing, Document Drafting, Contract Law",7 years
Person 354,Financial Analyst,"Forecasting, Financial Modeling, Data Analysis",10 years
Person 355,Software Engineer,"SQL, C++, Java",10 years
Person 356,Project Manager,"Team Management, Risk Management, Communication",8 years
Person 357,Sales Manager,"Sales Strategy, CRM, Customer Acquisition",3 years
Person 358,Content Writer,"Research, Content Strategy, Proofreading",7 years
Person 359,Sales Manager,"Customer Acquisition, CRM, Sales Strategy",6 years
Person 360,HR Manager,"Communication, Training, Employee Relations",5 years
Person 361,Content Writer,"Writing, Research, Creative Writing",5 years
Person 362,Content Writer,"Research, SEO, Blogging",2 years
Person 363,Legal Advisor,"Litigation, Legal Writing, Corporate Law",1 years
Person 364,Data Scientist,"TensorFlow, Python, Data Visualization",5 years
Person 365,Chef,"Teamwork, Food Presentation, Time Management",2 years
Person 366,Software Engineer,"Python, C++, SQL",6 years
Person 367,Financial Analyst,"SQL, Financial Modeling, Excel",2 years
Person 368,Teacher,"Communication, Education Technology, Lesson Planning",1 years
Person 369,HR Manager,"Employee Relations, Training, Organizational Development",8 years
Person 370,Teacher,"Pedagogy, Communication, Student Assessment",9 years
Person 371,Chef,"Cooking, Knife Skills, Time Management",4 years
Person 372,Digital Marketer,"Email Marketing, SEO, Brand Strategy",9 years
Person 373,Teacher,"Curriculum Design, Student Assessment, Education Technology",2 years
Person 374,Data Scientist,"TensorFlow, Machine Learning, Python",4 years
Person 375,Mechanic,"Engine Repair, Blueprint Reading, Safety Procedures",7 years
Person 376,Sales Manager,"Team Leadership, Client Relationships, Customer Acquisition",8 years
Person 377,Financial Analyst,"Accounting, Forecasting, Data Analysis",7 years
Person 378,Sales Manager,"Sales Strategy, CRM, Team Leadership",2 years
Person 379,Product Manager,"Market Research, Product Development, Communication",4 years
Person 380,Financial Analyst,"Forecasting, Budgeting, Financial Modeling",1 years
Person 381,Data Scientist,"SQL, Python, Machine Learning",3 years
Person 382,Graphic Designer,"Creativity, Adobe Illustrator, Figma",8 years
Person 383,Content Writer,"Proofreading, Blogging, SEO",1 years
Person 384,HR Manager,"Employee Relations, Performance Management, Training",7 years
Person 385,Data Scientist,"Statistics, Python, SQL",4 years
Person 386,HR Manager,"Communication, Recruitment, HR Software",1 years
Person 387,Nurse,"Teamwork, Critical Thinking, Medical Terminology",7 years
Person 388,Software Engineer,"Docker, Git, JavaScript",7 years
Person 389,Marketing Manager,"PPC, SEO, Brand Management",4 years
Person 390,Mechanic,"Manual Tools, Blueprint Reading, Engine Repair",10 years
Person 391,Graphic Designer,"Figma, Sketch, UI/UX Design",7 years
Person 392,Graphic Designer,"UI/UX Design, Creativity, Adobe Photoshop",1 years
Person 393,Sales Manager,"Team Leadership, Market Research, CRM",9 years
Person 394,Product Manager,"Leadership, Data Analysis, Agile",9 years
Person 395,Product Manager,"Data Analysis, Communication, Agile",6 years
Person 396,Financial Analyst,"QuickBooks, Power BI, SQL",1 years
Person 397,Sales Manager,"Customer Acquisition, Negotiation, Market Research",8 years
Person 398,Legal Advisor,"Corporate Law, Legal Research, Compliance",10 years
Person 399,Data Scientist,"R, Machine Learning, NumPy",5 years
Person 400,Software Engineer,"Git, Kubernetes, C++",9 years
Person 401,Graphic Designer,"Adobe Photoshop, Figma, Adobe Illustrator",5 years
Person 402,Data Scientist,"R, SQL, NumPy",10 years
Person 403,Digital Marketer,"SEO, Social Media Marketing, Google Analytics",9 years
Person 404,Sales Manager,"Negotiation, Team Leadership, Client Relationships",1 years
Person 405,HR Manager,"Organizational Development, HR Software, Training",3 years
Person 406,Content Writer,"Content Strategy, Writing, Proofreading",10 years
Person 407,Sales Manager,"Market Research, Team Leadership, Negotiation",2 years
Person 408,Data Scientist,"Statistics, NumPy, SQL",9 years
Person 409,Web Developer,"JavaScript, SQL, HTML",8 years
Person 410,Customer Support,"CRM Software, Problem Solving, Time Management",2 years
Person 411,Mechanic,"Problem Solving, Safety Procedures, Engine Repair",2 years
Person 412,Teacher,"Lesson Planning, Education Technology, Classroom Management",6 years
Person 413,Financial Analyst,"Budgeting, Forecasting, Financial Modeling",4 years
Person 414,Mechanic,"Engine Repair, Diagnostics, Blueprint Reading",10 years
Person 415,Product Manager,"Agile, UX/UI, Roadmap Planning",3 years
Person 416,Nurse,"Clinical Skills, Critical Thinking, Medical Terminology",5 years
Person 417,Teacher,"Curriculum Design, Student Assessment, Pedagogy",10 years
Person 418,Web Developer,"Node.js, SQL, React",3 years
Person 419,Web Developer,"REST APIs, HTML, SQL",2 years
Person 420,Chef,"Knife Skills, Teamwork, Menu Planning",7 years
Person 421,Web Developer,"SQL, React, REST APIs",6 years
Person 422,Electrician,"Troubleshooting, Wiring, Problem Solving",2 years
Person 423,Product Manager,"Leadership, Market Research, Agile",4 years
Person 424,HR Manager,"Training, HR Software, Labor Laws",4 years
Person 425,Software Engineer,"Java, Cloud Computing, Agile",4 years
Person 426,Project Manager,"Risk Management, Project Planning, Budgeting",7 years
Person 427,Mechanic,"Engine Repair, Vehicle Maintenance, Safety Procedures",1 years
Person 428,Digital Marketer,"PPC, Google Ads, Brand Strategy",9 years
Person 429,Legal Advisor,"Compliance, Corporate Law, Negotiation",3 years
Person 430,Nurse,"Patient Assessment, Critical Thinking, Medical Terminology",5 years
Person 431,Sales Manager,"Client Relationships, Team Leadership, Sales Strategy",3 years
Person 432,Project Manager,"Risk Management, Stakeholder Management, Project Planning",7 years
Person 433,Graphic Designer,"Adobe Photoshop, Figma, UI/UX Design",10 years
Person 434,Mechanic,"Manual Tools, Diagnostics, Safety Procedures",10 years
Person 435,Data Scientist,"Machine Learning, Statistics, SQL",8 years
Person 436,Content Writer,"SEO, Blogging, Writing",10 years
Person 437,Legal Advisor,"Contract Law, Corporate Law, Negotiation",7 years
Person 438,Digital Marketer,"Email Marketing, Brand Strategy, Google Ads",7 years
Person 439,Financial Analyst,"Power BI, QuickBooks, SQL",6 years
Person 440,Marketing Manager,"Marketing Strategy, Email Marketing, Brand Management",6 years
Person 441,Chef,"Cooking, Teamwork, Food Safety",9 years
Person 442,Project Manager,"Time Management, Communication, Team Management",3 years
Person 443,Legal Advisor,"Document Drafting, Legal Research, Legal Writing",4 years
Person 444,Sales Manager,"Customer Acquisition, CRM, Market Research",6 years
Person 445,Content Writer,"Editing, Content Strategy, Creative Writing",7 years
Person 446,Software Engineer,"Agile, Kubernetes, JavaScript",8 years
Person 447,Software Engineer,"Cloud Computing, Java, SQL",6 years
Person 448,Content Writer,"Research, Editing, SEO",7 years
Person 449,Chef,"Food Presentation, Cooking, Creativity",7 years
Person 450,Digital Marketer,"Content Creation, Email Marketing, Social Media Marketing",1 years
Person 451,Project Manager,"Stakeholder Management, Time Management, Communication",4 years
Person 452,Sales Manager,"Client Relationships, Negotiation, Sales Strategy",9 years
Person 453,Financial Analyst,"Data Analysis, Budgeting, QuickBooks",2 years
Person 454,Web Developer,"React, Git, REST APIs",1 years
Person 455,Project Manager,"Budgeting, Agile, Stakeholder Management",7 years
Person 456,Software Engineer,"Agile, Python, Cloud Computing",7 years
Person 457,HR Manager,"Labor Laws, Training, Communication",6 years
Person 458,Teacher,"Student Assessment, Communication, Lesson Planning",8 years
Person 459,Software Engineer,"JavaScript, Kubernetes, SQL",4 years
Person 460,Product Manager,"Agile, Market Research, Communication",2 years
Person 461,Digital Marketer,"PPC, Social Media Marketing, Google Ads",8 years
Person 462,Project Manager,"Stakeholder Management, Risk Management, Time Management",3 years
Person 463,Data Scientist,"NumPy, Statistics, R",6 years
Person 464,Project Manager,"Team Management, Risk Management, Agile",5 years
Person 465,Software Engineer,"Docker, Kubernetes, Agile",5 years
Person 466,Customer Support,"Time Management, Empathy, Communication",2 years
Person 467,Graphic Designer,"Figma, Adobe Illustrator, Sketch",6 years
Person 468,Nurse,"Patient Care, Pharmaceutical Knowledge, Critical Thinking",8 years
Person 469,Graphic Designer,"Adobe Photoshop, Color Theory, Creativity",7 years
Person 470,Electrician,"Wiring, Circuitry, Problem Solving",10 years
Person 471,Graphic Designer,"Color Theory, Sketch, Adobe Photoshop",8 years
Person 472,Customer Support,"Problem Solving, Communication, Time Management",5 years
Person 473,Data Scientist,"NumPy, Data Visualization, Deep Learning",4 years
Person 474,Software Engineer,"Kubernetes, Cloud Computing, Docker",7 years
Person 475,Customer Support,"CRM Software, Customer Service, Problem Solving",1 years
Person 476,Legal Advisor,"Compliance, Legal Research, Litigation",3 years
Person 477,Customer Support,"Customer Service, Problem Solving, Communication",1 years
Person 478,Project Manager,"Risk Management, Agile, Time Management",10 years
Person 479,Digital Marketer,"SEO, Content Creation, Google Analytics",4 years
Person 480,HR Manager,"Communication, Training, HR Software",2 years
Person 481,Electrician,"Blueprint Reading, Electrical Codes, Wiring",6 years
Person 482,Software Engineer,"Python, Cloud Computing, C++",9 years
Person 483,Chef,"Time Management, Creativity, Food Presentation",2 years
Person 484,Mechanic,"Engine Repair, Problem Solving, Vehicle Maintenance",10 years
Person 485,Data Scientist,"R, Deep Learning, Statistics",10 years
Person 486,HR Manager,"Employee Relations, Performance Management, Recruitment",1 years
Person 487,Marketing Manager,"PPC, Email Marketing, Brand Management",4 years
Person 488,Nurse,"Critical Thinking, Patient Care, Patient Assessment",4 years
Person 489,Electrician,"Circuitry, Problem Solving, Troubleshooting",10 years
Person 490,Teacher,"Pedagogy, Lesson Planning, Classroom Management",4 years
Person 491,Electrician,"Electrical Codes, Troubleshooting, Problem Solving",10 years
Person 492,Project Manager,"Stakeholder Management, Time Management, Risk Management",2 years
Person 493,Mechanic,"Engine Repair, Safety Procedures, Blueprint Reading",9 years
Person 494,Legal Advisor,"Legal Writing, Corporate Law, Document Drafting",3 years
Person 495,Electrician,"Electrical Codes, Safety Procedures, Problem Solving",6 years
Person 496,Product Manager,"Agile, Data Analysis, Market Research",1 years
Person 497,Sales Manager,"Customer Acquisition, Team Leadership, CRM",8 years
Person 498,HR Manager,"Organizational Development, Employee Relations, Recruitment",1 years
Person 499,Legal Advisor,"Compliance, Legal Writing, Negotiation",4 years
Person 500,Web Developer,"CSS, Vue.js, SQL",1 years
